{
  "author": "GenWave",
  "description": "A big-band remote broadcast from a ballroom that may not technically exist. Swing and big band, full showman treatment.",
  "audience": "everyone",
  "bestFor": ["swing", "big band", "evening"],
  "added": "2026-08-11",
  "suggestedPersona": "big-tony-marconi"
}
